{
  "protocolVersion": 2,
  "responseId": "response-01J0000000000000000000",
  "requestId": "permission-01J000000000000000000",
  "jobId": "job-01J000000000000000000000",
  "runtimeId": "runtime-01J00000000000000000000000",
  "stateVersion": 8,
  "leaseEpoch": 7,
  "kind": "permission",
  "value": "approve",
  "planId": "plan-3bhk-001",
  "planRevision": 2,
  "planFingerprint": "726a0230b5f1f702aa7633311dbf22932f9a74bf14b8b3bf817449793f33be99",
  "respondedAt": "2026-07-26T12:03:00.000Z",
  "decision": "approve",
  "permissionGrant": {
    "algorithm": "Ed25519",
    "issuer": "https://www.datumm.ai",
    "kid": "fixture-ed25519-rfc8032-1",
    "jti": "permission-grant-01J0000000000000",
    "permissionRequestId": "permission-01J000000000000000000",
    "permissionResponseId": "response-01J0000000000000000000",
    "decision": "approve",
    "userSubject": "user_fixture_001",
    "desktopDeviceId": "desktop-device-001",
    "runtimeId": "runtime-01J00000000000000000000000",
    "jobId": "job-01J000000000000000000000",
    "revitInstanceId": "revit-01J00000000000000000000",
    "documentFingerprint": "doc-fingerprint-0000000000000001",
    "leaseEpoch": 7,
    "tool": "delete_elements",
    "payloadHash": "9999999999999999999999999999999999999999999999999999999999999999",
    "issuedAt": "2026-07-26T12:03:00.000Z",
    "expiresAt": "2026-07-26T12:08:00.000Z",
    "signature": "BpdwMIJ6251OdN70mKTD6FCXsJRAGrrJ9H7liLqMGgzVN1seQO7wPTD9Lrft0aIH-M50OyhwIgC399rDlIoTDg"
  }
}
